{
  "format": "dubsar.judgment.input/1",
  "authority": "none",
  "content_trust": "advisory_data",
  "text_role": "data",
  "truth": "not_selected",
  "executable": false,
  "scope": {
    "project_id": "project-fixture",
    "mission_id": "mission-fixture",
    "ticket_id": "DUB-900"
  },
  "question": "Ce résultat technique exact est-il documenté ?",
  "context": {
    "agent_context_digest": null,
    "snapshot_atomic": false,
    "elements": [
      {
        "element_id": "e_e5",
        "source": "my_work",
        "kind": "automation_result",
        "reference": {
          "ref": "event_run_fixture_example_1",
          "digest": "95d61d03953af2d90c801f35c4f9896855ea6dc2758ad6562473fde18a8aaab7",
          "digest_scheme": "dubsar.automation.run-event.v1"
        },
        "availability": "available",
        "content_verification": "matched",
        "text": "E5 succeeded accepté ; mission_criteria=not_evaluated.",
        "freshness": "unknown",
        "temporal_scope": "historical",
        "source_observed_at": "2026-09-28T19:00:00.000Z",
        "origin_ids": [
          "origin_e5"
        ],
        "provenance_complete": true,
        "limit_ids": [
          "l_history",
          "l_mission"
        ],
        "facts": {
          "automation": {
            "run_id": "run_fixture_example",
            "event_id": "event_run_fixture_example_1",
            "state": "succeeded",
            "result": "documented",
            "mission_criteria": "not_evaluated",
            "reference_contents_read": false,
            "reference_availability": "not_checked"
          },
          "oc": null
        }
      },
      {
        "element_id": "e_proof",
        "source": "evidence",
        "kind": "evidence",
        "reference": {
          "ref": "artifact:proof-exact",
          "digest": "sha256:aaaaaaaaaaaaaaaaaaaaaaaaaaaaaaaaaaaaaaaaaaaaaaaaaaaaaaaaaaaaaaaa",
          "digest_scheme": "sha256-bytes"
        },
        "availability": "available",
        "content_verification": "not_checked",
        "text": null,
        "freshness": "unknown",
        "temporal_scope": "historical",
        "source_observed_at": "2026-10-04T00:00:00.000Z",
        "origin_ids": [
          "origin_e5"
        ],
        "provenance_complete": true,
        "limit_ids": [
          "l_history",
          "l_reference"
        ],
        "facts": {
          "automation": null,
          "oc": null
        }
      }
    ],
    "origins": [
      {
        "origin_id": "origin_e5",
        "reference": {
          "ref": "event_run_fixture_example_1",
          "digest": "95d61d03953af2d90c801f35c4f9896855ea6dc2758ad6562473fde18a8aaab7",
          "digest_scheme": "dubsar.automation.run-event.v1"
        }
      }
    ],
    "limits": [
      {
        "limit_id": "l_history",
        "code": "HISTORICAL_ONLY",
        "detail": "La date source décrit un événement historique.",
        "mandatory": true
      },
      {
        "limit_id": "l_mission",
        "code": "MISSION_CRITERIA_NOT_EVALUATED",
        "detail": "Résultat de run distinct des critères de mission.",
        "mandatory": true
      },
      {
        "limit_id": "l_reference",
        "code": "REFERENCE_NOT_READ",
        "detail": "La référence ne prouve ni lecture ni disponibilité actuelle.",
        "mandatory": true
      }
    ],
    "omissions": {
      "elements": 0,
      "claims": 0,
      "consults": 0,
      "truncated": false
    }
  },
  "claims": [
    {
      "claim_id": "c_run",
      "kind": "automation_result",
      "statement": "Le résultat exact est documenté.",
      "candidate_element_ids": [
        "e_e5"
      ],
      "required_limit_ids": [],
      "requirements": {
        "min_independent_origins": 1,
        "requires_current": false,
        "requires_verified_content": true
      }
    },
    {
      "claim_id": "c_mission",
      "kind": "mission_criteria",
      "statement": "Le résultat exact est documenté.",
      "candidate_element_ids": [
        "e_e5"
      ],
      "required_limit_ids": [],
      "requirements": {
        "min_independent_origins": 1,
        "requires_current": false,
        "requires_verified_content": true
      }
    },
    {
      "claim_id": "c_proof",
      "kind": "evidence_sufficiency",
      "statement": "Le résultat exact est documenté.",
      "candidate_element_ids": [
        "e_proof"
      ],
      "required_limit_ids": [],
      "requirements": {
        "min_independent_origins": 1,
        "requires_current": false,
        "requires_verified_content": true
      }
    }
  ],
  "missing_information": [],
  "consult_catalog": {
    "owner": "server",
    "effect": "readonly",
    "entries": [
      {
        "consult_id": "consult_proof",
        "target_element_id": "e_proof",
        "read_kind": "evidence_content",
        "purpose": "Vérifier le contenu de la preuve exacte déjà référencée.",
        "state": "available",
        "expected_freshness": "unknown",
        "cost_microusd": {
          "value": null,
          "method": "unknown",
          "basis": "unknown"
        },
        "latency_ms": {
          "value": null,
          "method": "unknown",
          "basis": "unknown"
        }
      }
    ]
  },
  "budget": {
    "consults_remaining": 2,
    "tokens_remaining": 512,
    "cost_remaining_microusd": null,
    "latency_remaining_ms": null
  },
  "previous_judgment": null
}
